{
  "schema": "foundation-ai.proof.v1",
  "phase": "P33",
  "wave": 33,
  "name": "preflight",
  "status": "GREEN",
  "payload": {
    "schema": "foundation-ai.preflight.v1",
    "wave": 33,
    "scan": {
      "ownedHits": 0,
      "observedHits": 0,
      "status": "GREEN"
    },
    "proposals": [],
    "unhandled": [],
    "apply": false,
    "applied": [],
    "failed": [],
    "postScan": null,
    "relatedWaves": [],
    "flag": {
      "raised": false,
      "severity": "GREEN",
      "message": "wave 33 has no owned legacy hits — no preflight needed.",
      "programAdjustment": null
    },
    "lessonsLearned": []
  },
  "emittedAt": "2026-05-07T05:04:02.411Z",
  "hash": "sha256:eaadd8675a978ca22cf45445093140f25073bc8695b102d6ab38bda9d2b1ef9a"
}