{
  "schema": "foundation-ai.proof.v1",
  "phase": "P33",
  "wave": 33,
  "name": "run",
  "status": "GREEN",
  "payload": {
    "schema": "foundation-ai.wave.v1",
    "wave": 33,
    "title": "Post-Launch Governance Continuity (W33)",
    "steps": [
      {
        "id": "emit-continuity-proof",
        "status": "GREEN",
        "ms": 36,
        "tail": ""
      }
    ],
    "dryRun": false
  },
  "emittedAt": "2026-05-07T05:04:02.506Z",
  "hash": "sha256:385279f84c869c4f4f4932d7ee85dd31291e8030adfa74976c9fe7ce978e1d13"
}