{
  "schema": "foundation-ai.proof.v1",
  "phase": "E",
  "wave": 29,
  "name": "close",
  "status": "GREEN",
  "payload": {
    "bundle": {
      "wave": 29,
      "phases": {
        "entry": {
          "status": "GREEN",
          "hash": "sha256:5e8602ee793eea9f5eeb02b698a8f24af6e46c2aa5cb7f43f52d270fc07f35b1",
          "file": "/root/DOS-Platform/proofs/foundation-ai/wave-29/entry.proof.json"
        },
        "implementation": {
          "status": "GREEN",
          "hash": "sha256:213503fc5e97b85a6b39df22c4f47bda11d79f1cc9647e5f95593dc1c3461098",
          "file": "/root/DOS-Platform/proofs/foundation-ai/wave-29/implementation.proof.json"
        },
        "verification": {
          "status": "GREEN",
          "hash": "sha256:3cb95ff4d4688b208e97f6b2fc23a45b8ca1eb788f16811864af49eb9f17450b",
          "file": "/root/DOS-Platform/proofs/foundation-ai/wave-29/verification.proof.json"
        },
        "runtime": {
          "status": "GREEN",
          "hash": "sha256:9bcb96f0ccd52555ba6d520be1114ffafa9ea07aabac6380f0fac771987df2e7",
          "file": "/root/DOS-Platform/proofs/foundation-ai/wave-29/runtime.proof.json"
        }
      }
    },
    "commitSha": "b739b544eb0804c893b99e5cd7efb01ef3ca99cd",
    "tag": "wave-29-closed",
    "doctrine": "wave-closed"
  },
  "emittedAt": "2026-05-07T04:26:46.540Z",
  "hash": "sha256:b0db2508e1cd4f989bd175803b68de42d6b9b25b58085bfc4532a6b3a6fe3038"
}