{
  "schema": "foundation-ai.proof.v1",
  "phase": "P5",
  "wave": 5,
  "name": "run",
  "status": "GREEN",
  "payload": {
    "schema": "foundation-ai.wave.v1",
    "wave": 5,
    "title": "Edge & Ops Hygiene — RED severity flip",
    "steps": [
      {
        "id": "dynamic-ui-gates",
        "status": "WARN",
        "ms": 1050,
        "tail": "\n> dos-platform@0.0.0 dynamic-ui:gates /root/DOS-Platform\n> node scripts/ci-guards/carbon-dynamic-ui-coherence.mjs && node scripts/ci-guards/carbon-key-component-map-strict.mjs && node scripts/ci-guards/dynamic-ui-loader-resolvability.mjs && COMPONENT_MAP_ENFORCE=1 node scripts/ci-guards/component-map-coverage.mjs && TEMPLATE_COVERAGE_ENFORCE=1 node scripts/ci-guards/template-coverage.mjs && UI_REGISTRY_ENFORCE=1 node scripts/ui-registry/verify.mjs && AUTH_PAGES_COVERAGE_ENFORCE=1 node scripts/ci-guards/auth-pages-coverage.mjs && node scripts/ci-guards/lint-no-hardcoded-shell-labels.mjs\n\n[carbon-dynamic-ui-coherence] OK — catalog 315 carbon keys, 186 approved registry rows, 86 active route keys, 18 widget keys, COMPONENT_MAP 586 entries\n[carbon-dynamic-ui-coherence] note: 25 bare registry INSERT patterns detected (expect backfill migration)\n[carbon-key-component-map-strict] summary: {\n  \"registry_total\": 554,\n  \"registry_distinct_carbon_keys\": 180,\n  \"carbon_keys_with_real_renderer\": 180,\n  \"carbon_keys_placeholder_only\": 0,\n  \"component_map_entries\": 646,\n  \"required_public_carbon_keys\": 60,\n  \"required_public_catalog_keys\": 60,\n  \"required_public_registry_keys\": 60,\n  \"required_public_component_map_keys\": 60,\n  \"db_violations\": 0,\n  \"fe_missing_entries\": 7\n}\n ELIFECYCLE  Command failed with exit code 1.\n[carbon-key-component-map-strict] FAIL — 7 violation(s):\n  ✗ component_key 'workspace.shell.settings-action' (carbon_key='header-global-action') has NO entry in COMPONENT_MAP\n  ✗ component_key 'workspace.shell.user-menu' (carbon_key='header-global-action') has NO entry in COMPONENT_MAP\n  ✗ component_key 'workspace.shell.brand' (carbon_key='header-name') has NO entry in COMPONENT_MAP\n  ✗ component_key 'workspace.shell.workspace-title' (carbon_key='header-name') has NO entry in COMPONENT_MAP\n  ✗ component_key 'workspace.shell.sidebar-nav' (carbon_key='side-nav-items') has NO entry in COMPONENT_MAP\n  ✗ component_key 'workspace.shell.empty-state' (carbon_key='tile') has NO entry in COMPONENT_MAP\n  ✗ component_key 'workspace.shell.module-cards' (carbon_key='tile') has NO entry in COMPONENT_MAP\n"
      },
      {
        "id": "platform-customer-gate",
        "status": "WARN",
        "ms": 1565,
        "tail": "\n> dos-platform@0.0.0 platform:customer-gate /root/DOS-Platform\n> pnpm dynamic-ui:gates && pnpm --filter @dos/platform-app build && node scripts/ci-guards/props-coverage.mjs && node scripts/ci-guards/workspace-shell-readiness-gate.mjs && TEMPLATE_ONLY_ROUTING_ENFORCE=1 node scripts/ci-guards/template-only-routing.mjs && node scripts/ci-guards/lint-no-static-nav-fallback.mjs\n\n\n> dos-platform@0.0.0 dynamic-ui:gates /root/DOS-Platform\n> node scripts/ci-guards/carbon-dynamic-ui-coherence.mjs && node scripts/ci-guards/carbon-key-component-map-strict.mjs && node scripts/ci-guards/dynamic-ui-loader-resolvability.mjs && COMPONENT_MAP_ENFORCE=1 node scripts/ci-guards/component-map-coverage.mjs && TEMPLATE_COVERAGE_ENFORCE=1 node scripts/ci-guards/template-coverage.mjs && UI_REGISTRY_ENFORCE=1 node scripts/ui-registry/verify.mjs && AUTH_PAGES_COVERAGE_ENFORCE=1 node scripts/ci-guards/auth-pages-coverage.mjs && node scripts/ci-guards/lint-no-hardcoded-shell-labels.mjs\n\n[carbon-dynamic-ui-coherence] OK — catalog 315 carbon keys, 186 approved registry rows, 86 active route keys, 18 widget keys, COMPONENT_MAP 586 entries\n[carbon-dynamic-ui-coherence] note: 25 bare registry INSERT patterns detected (expect backfill migration)\n[carbon-key-component-map-strict] summary: {\n  \"registry_total\": 554,\n  \"registry_distinct_carbon_keys\": 180,\n  \"carbon_keys_with_real_renderer\": 180,\n  \"carbon_keys_placeholder_only\": 0,\n  \"component_map_entries\": 646,\n  \"required_public_carbon_keys\": 60,\n  \"required_public_catalog_keys\": 60,\n  \"required_public_registry_keys\": 60,\n  \"required_public_component_map_keys\": 60,\n  \"db_violations\": 0,\n  \"fe_missing_entries\": 7\n}\n ELIFECYCLE  Command failed with exit code 1.\n ELIFECYCLE  Command failed with exit code 1.\n[carbon-key-component-map-strict] FAIL — 7 violation(s):\n  ✗ component_key 'workspace.shell.settings-action' (carbon_key='header-global-action') has NO entry in COMPONENT_MAP\n  ✗ component_key 'workspace.shell.user-menu' (carbon_key='header-global-action') has NO entry in COMPONENT_MAP\n  ✗ component_key 'workspace.shell.brand' (carbon_key='header-name') has NO entry in COMPONENT_MAP\n  ✗ component_key 'workspace.shell.workspace-title' (carbon_key='header-name') has NO entry in COMPONENT_MAP\n  ✗ component_key 'workspace.shell.sidebar-nav' (carbon_key='side-nav-items') has NO entry in COMPONENT_MAP\n  ✗ component_key 'workspace.shell.empty-state' (carbon_key='tile') has NO entry in COMPONENT_MAP\n  ✗ component_key 'workspace.shell.module-cards' (carbon_key='tile') has NO entry in COMPONENT_MAP\n"
      },
      {
        "id": "drift-sample",
        "status": "GREEN",
        "ms": 660,
        "tail": "> dos-platform@0.0.0 drift:sample /root/DOS-Platform\n> node scripts/ops/drift-telemetry-sample.mjs\n\n[drift-telemetry] sampled 10 metrics — 1 critical, 0 warn\n"
      }
    ],
    "dryRun": false
  },
  "emittedAt": "2026-05-06T19:27:10.292Z",
  "hash": "sha256:af10df40960870b9bd62ed921766cde50df8baaf2a1c5cc8029c8e213a4481b6"
}