{
  "schema": "foundation-ai.proof.v1",
  "phase": -2,
  "wave": 33,
  "name": "zerodirt",
  "status": "GREEN",
  "payload": {
    "schema": "foundation-ai.zerodirt.v1",
    "status": "GREEN",
    "checks": {
      "Z1_no_untracked_in_scope": "GREEN",
      "Z2_no_backup_files": "GREEN",
      "Z4_no_forbidden_tokens": "GREEN",
      "Z5_mirror_shell_collapsed": "GREEN",
      "Z9_no_unowned_todos": "GREEN"
    },
    "findings": {
      "untracked": [
        "proofs/foundation-ai/_ledger/HEAD",
        "proofs/foundation-ai/wave--2/inventory.proof.json",
        "proofs/foundation-ai/wave--2/plan-sync.proof.json",
        "proofs/foundation-ai/_ledger/2026-05-07T05-03-49-470Z__PLAN_SYNC.json",
        "proofs/foundation-ai/_ledger/2026-05-07T05-04-01-962Z__PHASE-A.json",
        "proofs/foundation-ai/_ledger/2026-05-07T05-04-02-018Z__INVENTORY.json",
        "proofs/foundation-ai/_ledger/2026-05-07T05-04-02-399Z__ZERODIRT.json",
        "proofs/foundation-ai/_ledger/2026-05-07T05-04-02-414Z__PREFLIGHT.json",
        "proofs/foundation-ai/_ledger/2026-05-07T05-04-02-509Z__RUN.json",
        "proofs/foundation-ai/_ledger/2026-05-07T05-04-02-741Z__PHASE-B.json",
        "proofs/foundation-ai/_ledger/2026-05-07T05-04-28-817Z__PHASE-C.json",
        "proofs/foundation-ai/_ledger/2026-05-07T05-04-28-916Z__INVENTORY.json",
        "proofs/foundation-ai/_ledger/2026-05-07T05-04-29-262Z__ZERODIRT.json",
        "proofs/foundation-ai/_ledger/2026-05-07T05-04-29-273Z__GATE.json",
        "proofs/foundation-ai/_ledger/2026-05-07T05-04-29-812Z__ZERODIRT.json",
        "proofs/foundation-ai/_ledger/2026-05-07T05-04-29-823Z__DRIFT.json",
        "proofs/foundation-ai/wave-33/drift.proof.json",
        "proofs/foundation-ai/wave-33/entry.proof.json",
        "proofs/foundation-ai/wave-33/implementation.proof.json",
        "proofs/foundation-ai/wave-33/preflight.proof.json",
        "proofs/foundation-ai/wave-33/quality-gate.proof.json",
        "proofs/foundation-ai/wave-33/run.proof.json",
        "proofs/foundation-ai/wave-33/verification.proof.json",
        "proofs/foundation-ai/wave-33/zerodirt.proof.json"
      ],
      "backups": [],
      "forbidden": [],
      "mirrorShell": [
        "modules/core/platform/shell/index.ts",
        "modules/core/platform/shell/auth-logout.service.ts",
        "modules/core/platform/shell/breadcrumb.service.ts",
        "modules/core/platform/shell/correlation-id.interceptor.ts",
        "modules/core/platform/shell/dos-page-layout.component.ts",
        "modules/core/platform/shell/dynamic-template-page.component.ts",
        "modules/core/platform/shell/module-content-provider.ts",
        "modules/core/platform/shell/page-context-labels.ts",
        "modules/core/platform/shell/route-metadata.service.ts",
        "modules/core/platform/shell/shell-connectivity.service.ts",
        "modules/core/platform/shell/shell-error-state.service.ts",
        "modules/core/platform/shell/shell-host.component.ts",
        "modules/core/platform/shell/shell-preferences.service.ts",
        "modules/core/platform/shell/template-binding.registry.ts",
        "modules/core/platform/shell/template-binding.service.ts",
        "modules/core/platform/shell/workspace-shell-binding.service.ts"
      ],
      "staleTodos": [],
      "forbiddenObserved": []
    }
  },
  "emittedAt": "2026-05-07T05:04:30.142Z",
  "hash": "sha256:1bcaf91cda6a7d8d7197a980af152276edd7af35448cf7ab9a6dd538ab5fb0c4"
}