{
  "schema": "foundation-ai.proof.v1",
  "phase": "E",
  "wave": 30,
  "name": "close",
  "status": "GREEN",
  "payload": {
    "bundle": {
      "wave": 30,
      "phases": {
        "entry": {
          "status": "GREEN",
          "hash": "sha256:09ba441edefcb0b778010a0668aabff84d0e238b1483222441db561e073e1a71",
          "file": "/root/DOS-Platform/proofs/foundation-ai/wave-30/entry.proof.json"
        },
        "implementation": {
          "status": "GREEN",
          "hash": "sha256:80e5308fd531ec34bc42207c44dfe4c3d6ce4756a8acf5a6ed018ec21a6a5adc",
          "file": "/root/DOS-Platform/proofs/foundation-ai/wave-30/implementation.proof.json"
        },
        "verification": {
          "status": "GREEN",
          "hash": "sha256:04869343f453d49c5f519142fb6ba794462cc66bb29695d283a8095ee13e6d9b",
          "file": "/root/DOS-Platform/proofs/foundation-ai/wave-30/verification.proof.json"
        },
        "runtime": {
          "status": "GREEN",
          "hash": "sha256:2bfcdada76e4011aedc48605e9aa8a50268bdd62e92aa417619a2827b11060c1",
          "file": "/root/DOS-Platform/proofs/foundation-ai/wave-30/runtime.proof.json"
        }
      }
    },
    "commitSha": "641366c45850ebc35cc0aff632a298dd15f27589",
    "tag": "wave-30-closed",
    "doctrine": "wave-closed"
  },
  "emittedAt": "2026-05-07T04:46:21.429Z",
  "hash": "sha256:05dd5e4f362411d0f2f0f8f9770f0b6b914e680005b7354a514ab3df352fb3ec"
}