{
  "schema": "foundation-ai.proof.v1",
  "phase": "P13",
  "wave": 13,
  "name": "run",
  "status": "GREEN",
  "payload": {
    "schema": "foundation-ai.wave.v1",
    "wave": 13,
    "title": "Public Contract Ecosystem",
    "steps": [
      {
        "id": "contracts-build",
        "status": "GREEN",
        "ms": 1972,
        "tail": "\n> @dos/ui-contracts@1.0.0 build /root/DOS-Platform/platform/ui-system/dos-ui-contracts\n> tsc -p tsconfig.build.json\n\n"
      },
      {
        "id": "ensure-v1-contracts",
        "status": "GREEN",
        "ms": 3,
        "tail": ""
      }
    ],
    "dryRun": false
  },
  "emittedAt": "2026-05-06T19:36:06.934Z",
  "hash": "sha256:61720a89370b6ff1e374b0c302a72cd5f037d794d0b5ec57546c57f1dd2a087c"
}