{
  "schema": "foundation-ai.proof.v1",
  "phase": -2,
  "wave": 13,
  "name": "drift",
  "status": "GREEN",
  "payload": {
    "schema": "foundation-ai.drift.v1",
    "wave": 13,
    "detectors": {
      "D_scope_dirty": {
        "count": 0,
        "status": "GREEN",
        "samples": []
      },
      "D_tokens": {
        "ownedHits": 0,
        "observedHits": 0,
        "status": "GREEN"
      }
    }
  },
  "emittedAt": "2026-05-06T19:39:22.488Z",
  "hash": "sha256:27c8a145fed22aeac2fab192e19b4bfecdd63a46a6aac1028b20de23febaf7ec"
}